url,normalized_text
https://www.mindbodygreen.com/partner/haven-well-within,haven well within mindbodygreen skip to content accessibility statement haven well within haven well within is a marketplace a holistic one stop shop offering everything our customer needs to create a haven at home of course we re here to inspire not overwhelm which is where our experiences come into play haven well within s vision is to empower women to prioritize their wellbeing so they realize their full potential in the world connect with haven well within your browser does not support the video tag your browser does not support the video tag
https://www.mindbodygreen.com/articles/how-team-usa-rugby-star-ilona-maher-stays-strong,how team usa rugby star ilona maher stays strong mindbodygreen skip to content accessibility statement personal growth how team usa rugby star ilona maher stays strong is getting ready for the olympics author alexandra engler july senior beauty lifestyle director by alexandra engler senior beauty lifestyle director alexandra engler is the senior beauty and lifestyle director at mindbodygreen and host of the beauty podcast clean beauty school previously she s held beauty roles at harper s bazaar marie claire self and cosmopolitan her byline has appeared in esquire sports illustrated and allure com july we carefully vet all products and services featured on mindbodygreen using our commerce guidelines our selections are never influenced by the commissions earned from our links we love celebrating women on top of their game in our new series game on we re interviewing top athletes about their well being routines covering everything from nutrition that makes them feel strong to the moments that bring them joy if you ve come across year old team usa rugby star ilona maher s tiktok videos you know how charming she can be considering her page has over million followers and million likes there s a good chance you ve come across a video or two if you re on the platform in fact when i shared that i d recently interviewed maher to a friend she gushed i love her tiktoks if you want to make a career out of rugby or if you want to make enough money as a professional athlete in rugby you have to have a social media presence i treat it as a second job if not right up there with my first job of being an athlete because at the spot we are as a sport and a women s sport i m not going to get too much of a livable income with just rugby she told me about why she s made social media a priority the rugby center s exploding popularity may be thanks to her social media prowess but make no mistake her strength will take center stage during this year s olympic games in paris as she gears up for her second olympics i was able to chat with her about how she stays strong what fuels her and why she wears lipstick on the field mindbodygreen what meals make you feel strongest ilona maher i don t feel bad about eating i ve been training my mind and training myself to get to that mindset even being a professional athlete but i think all women experience this we deal with eating and our bodies for me it s been really freeing to learn what foods it takes to be at my top performance the meals feel good when i know i need this food to fuel myself i m more about function versus form because right now i m supposed to be big i m supposed to be powerful and i m using these meals to do it but my favorite meals have to be the ones that my mom makes it s homey it s what i grew up on it s what kind of made me into the athlete i am today she can cook a steak like no one else and she makes this chicken satay that s amazing she marinates the chicken grills it and then makes this peanut butter sauce that you dip it in by the spoonful i would say that s my favorite mbg how do you mentally prepare for a game maher it s interesting because i try not to let rugby control my mind the whole time when people are like oh how do you do social media with the rugby but it s actually about finding that balance because if i was thinking about rugby all the time it would be a lot i think sometimes it can be a nice escape but to get into the game before it starts i do have to amp myself up it s such a hard sport i feel so tired constantly i m getting beat up out there and we play in these hot places i say to myself before i m about to run out if it were easy everybody would do it this is a very hard sport and i m so honored that i can do it it kind of puts it into perspective when i m tired it s also about connecting with my teammates and getting to do this with my best buddies mbg what s the most intense thing you ve ever tried to optimize your performance maher i don t know if this is really intense but heat training we play in such hot environments sometimes like singapore hong kong perth australia during heat waves and as high as degrees so we get into heat acclimation preparing yourself to be able to perform in that environment starts back home so even now i do heat acclimation just to prepare myself for summer in paris for example we ll sit in the sauna after we did a bike session in a heated room with sweatshirts and sweatpants on or we get into a hot tub with our sweatpants on mbg how do you rebound after a tough game maher that s been something i ve definitely been learning like constantly it never gets easier but you learn how to deal with it better in a way in the last olympics we lost and that was very hard but i ve been learning how to play it to my advantage after we lose one thing i focus on is connecting with my teammates because a lot of times people put things on themselves like oh i knocked that ball on or i missed that tackle that led to the loss it s important to remember that no one moment loses a game for us we have so many moments throughout a game and it s never that one moment like yeah maybe someone missed that tackle but what about earlier in the game when i missed it you re not out there alone and you re not losing on your own you re losing with this other group of women who are going through the same stuff so it s really important to be with them and connect with them laugh about it talk about the parts that went well the parts that went bad what to take from it mbg i wanted to ask you about teammates anyway one of the things that playing sports teaches us is how to be a good teammate and how to show up for other people so what makes a good teammate how do you show up for your teammates maher i think what s fun about being on a team is having those different personalities around you you need the person who is going to go quiet and wants to get in their head before a game or myself before a game i m loud i want to dance and i want to connect with people so it s important to recognize there are so many different teammates and personalities that make up a team and that s what makes a team special you don t want all the same athletes out there being a good teammate is also about helping others rise up as well for example what i ve been trying to do on social media has been for myself but it s also been for my teammates i try to bring them into any video i can or encourage them to post my teammate once told me a rising tide lifts all boats which is a great way to think about it it s about lifting up others lifting my teammates and making them feel good mbg the social media side of it is interesting because we re definitely in this moment in which women athletes are receiving more and much deserved attention and for many athletes social media can be a tool to ensure longevity in their career or after their career you mentioned earlier that it s about finding a balance between the two how do you find that balance maher i ve almost had to find a balance if you want to make a career out of rugby or if you want to make enough money as a professional athlete in rugby you have to have a social media presence i treat it as a second job if not right up there with my first job of being an athlete because at the spot we are as a sport and a women s sport i m not going to get too much of a livable income with just rugby i do get paid for rugby and it s amazing that i have that possibility for me in the u s but all of us want to make more money and all of us want to get sponsored and after the tokyo olympics i realized oh this is how i can do that i have to use this tool to my advantage my teammates and i talk about this all the time i want to make more money or i want to get sponsors and the thing is you have to post it s a very vulnerable state but you have to put yourself out there it s scary sometimes but i view it as this is how i make this career sustainable for a lot of athletes after they retire they just go back to regular jobs like this was all a fever dream of traveling the world to play rugby but i want to make this my career long term image by mbg creative courtesy of source mbg this touches on a topic i wanted to discuss anyway what are the double standards that exist for women versus men in rugby that you want to address maher well i think the first thing is that rugby is only a men s sport that it is so physical it s not meant for women and you have to be a man to play it and to play rugby as a woman there s this idea that you have to almost reject your femininity and go out there and be a masculine version of yourself and for a lot of sports that stops girls from playing because they ll think i don t want people to think of me this way or i don t want to risk my femininity or how beautiful i feel those misconceptions stop people from playing sports they stop people from really understanding what their body s capable of sports give your body a purpose that s not just to be looked at and objectified i think sports give you an appreciation for your body i think for me being that rugby athlete in the limelight i want to show that i can be this very big powerful person but i can also wear lipstick on the field to show that you can bring your femininity on the field too i know that in our seventh circuit now we have a lot of girls who put on a full face of makeup and who want to go out there and be pretty i love that because i don t think you have to sacrifice that to play this traditionally very manly sport i think what s cool about our game is that people are like oh well maybe it s not like the men s in every way it s different in some ways and different doesn t mean bad they re still both very exciting games to watch mbg that s a really important message because when you look at the research the reason young girls drop out of sports at a higher rate than boys is usually because of confidence issues so to show that you can be confident in both sides of yourself is really valuable speaking of embracing different sides of yourself i know you love beauty products what products do you love using right now maher i ve been using medalist which is a new brand that s by athletes for athletes we ve been testing out the products like no fric stick anti chafe cooling balm which i use on and off the field it s been really helpful for my pregame pre practice and after practice routine what i really love is that we re working with athletes of all abilities all sports and all disciplines athletes come in truly all shapes and sizes and need their skin care routines mbg being a professional athlete has a unique challenge of it being this thing you obviously love doing but is at the end of the day a high pressure job in what moments do you find that childlike joy again maher it s funny before practices we ll play fun games it s literally grown women you know some in our late s or s playing tag with each other we re laughing and giggling i made a joke that my friend just got married and bought a house but i m here playing tag with my friends in the sun but that brings me back to like why i love it i love the community of sports how it brings you in and how it makes you feel about yourself i think that those are the moments where i really get back to why i love rugby and love the people i get to do it with
https://www.mindbodygreen.com/articles/2-places-to-never-put-your-cut-flowers-if-you-want-them-to-last,places to never put your cut flowers if you want them to last mindbodygreen skip to content accessibility statement nature want to keep cut flowers alive for longer here s a science backed trick author emma loewe august by emma loewe mbg contributor emma loewe is the former sustainability and health director at mindbodygreen she is the author of return to nature the new science of how natural landscapes restore us and the co author of the spirit almanac a modern guide to ancient self care emma received her b a in environmental science policy with a specialty in environmental communications from duke university in addition to penning over mbg articles on topics from the water crisis in california to the rise of urban beekeeping her work has appeared on grist bloomberg news bustle and forbes image by marta locklear stocksy august we carefully vet all products and services featured on mindbodygreen using our commerce guidelines our selections are never influenced by the commissions earned from our links even though we know that flowers bloom and fade in their own time it s hard to be patient whenever we bring a fresh bouquet home the hope is that it ll stay vivacious and vibrant for as many days as possible thankfully there are a few ways to play with the water in a cut flower vase to help blooms last longer and adjusting surrounding air quality can also help stave off decay to a degree when it comes to clearing the air so your flowers can stay fresh ethylene is the name to know ethylene is a gaseous hormone that flowers and fruits accumulate and emit as they age caren chang ph d a professor at the university of maryland who researches the gas says that on the plus side it helps promote fruit ripening it s why you can stick a green tomato into a paper bag with a nearly gone banana the banana will emit ethylene gas that helps the tomato ripen the downside chang explains is that ethylene can also cause leaves to drop and flower petals to die off injured flowers like those that have just been collected for a bouquet will give off a lot of ethylene as a last resort hence why cut flowers tend to lose their vigor relatively quickly as such to keep them in good shape for longer you ll want to minimize their exposure to any excess ethylene gas here are two easy ways to do so place them away from fruit bowls some plant species emit more ethylene than others tomatoes apples bananas pears and many other fruits emit a high level of ethylene because in most plants the ethylene hormone is an essential hormone for fruit ripening chang tells mindbodygreen once in the air the ethylene that these fruits emit can travel a long way in the process it tends to disperse and lose some of its potency chang notes that by the time it reaches any nearby flowers the ethylene from fruits will likely have diffused enough to not be an issue however floral stylist harriet parry previously told mbg that she s noticed flowers do tend to fade faster when placed next to fruits to play it safe you may want to keep your cut flowers away from your open fruit bowls to prevent premature decay place them away from grills or fire pits natural gas and petroleum are also major sources of ethylene a natural byproduct of combustion meaning they can be harmful to plant life for evidence of this chang points to one study conducted on the busy beltway highway in washington d c that found that the high ethylene levels from car exhaust caused nearby plants to grow stunted when the ethylene was chemically removed from the beltway environment the plants looked much better she says and back in the s when street lamps were lit with gas the trees surrounding the street lamps tended to drop their leaves for this reason chang recommends placing all your plants cut or not away from any gas source car exhaust fire pits barbecue grills oil lanterns etc to keep them growing vigorously the takeaway there are many ways to get a few more colorful days out of your cut flowers besides the basic care tips like cutting their stems at an angle cleaning out their water and keeping them away from direct sun placing them out of ethylene hot spots may help them bloom brighter and longer source https www tandfonline com doi abs
https://www.mindbodygreen.com/articles/solawave-black-friday-sale-2025,solawave sale save on this viral red light device mindbodygreen skip to content accessibility statement beauty i replaced half my skin care routine with this one device it s never looked better author carleigh ferrante november mbg senior commerce editor by carleigh ferrante mbg senior commerce editor carleigh ferrante is the commerce editor at mindbodygreen image by carleigh ferrante mbg creative november we carefully vet all products and services featured on mindbodygreen using our commerce guidelines our selections are never influenced by the commissions earned from our links i ve been using solawave s in red light wand longer than any other facial device and i ll rave about it to anyone who will listen seriously the results are so good that even my dermatologist questioned what changed in my skincare routine that s why i m ready to shout the brand s current sale from the rooftops right now solawave s entire site is buy one get one free including my favorite red light wand allow me to tell you why i swear by this product for plumper brighter skin but don t waffle over your purchase too long the sale ends on monday taking these unbeatable prices with it solawave in skincare wand why i can t stop talking about the solawave my solawave love story first began when my friend and i decided to test the wand leading up to her wedding because what better time to see if this sleek device could actually reduce the appearance of wrinkles fine lines dark circles and blemishes at the time i couldn t scroll through social media without being served a testimonial for solawave s in red light wand but the skeptic in me questioned these reviewers potentially filtered glow turns out the wand was worth the hype after seeing results from day one read less puffiness and a smoother more sculpted face i quickly integrated the device into my routine where it s remained ever since i find it incredibly difficult to stick to skin care routines but the visible results kept me coming back to the solawave image by mbg creative by spending just five minutes per day with the wand my skin has continued to improve with time since then i ve noticed less redness my biggest skin concern a more even tone and fewer fine lines around my mouth and eyes what s more countless friends have commented on how glowy my skin looks pro tip don t skip your neck it s where i ve seen the most significant change in smoothness since incorporating the solawave into my beauty routine and the brand just launched a red light mask designed specifically to renew the skin on your neck and chest the best part i ve cut back majorly on professional facials and i m saving a ton of money when i did see my facialist a few months after purchasing the solawave she even commented on my skin s improvements and questioned what i was doing differently solawave in skincare wand the takeaway despite my initial skepticism the solawave has proven itself tenfold my previously mentioned friend and i still use our devices regularly raving to each other about our smoother glowier skin my only regret is not buying this deal when i had the chance but i ll be taking advantage of it this holiday season to give the ultimate gift
https://www.mindbodygreen.com/articles/are-your-mushroom-supplements-helping-your-immune-system,are your mushroom supplements helping your immune system mindbodygreen skip to content accessibility statement paid content for are your mushroom supplements helping your immune system author devon barrow june branded content editor by devon barrow image by andrew thomas stocksy june so you ve been wondering about taking functional mushrooms to support your immune system it s a wise idea mushrooms are now well established for their inflammatory balancing and antioxidant properties plus they re full of proteins antioxidants and fatty acids all of which play a role in immunity these days the question is less about whether you re taking mushrooms and more about where you re getting them for the sake of your immune system you deserve the best the truth about your mushroom supplement if you re wondering what all the mushroom hype is about it starts with beta glucans these beneficial polysaccharides make up the cell walls of mushrooms and are connected to heart health gut health immune function inflammatory response and beyond research indicates that beta glucans and other beneficial components are found most abundantly in the mushroom s fruiting body that is everything aboveground however most mushroom supplements on the market today are made out of the mycelium or the root of the mushroom while mycelium certainly has its own benefits supplements made from the fruiting body guarantee you re getting the good stuff as far as quality goes gaia herbs pure extraction process sets the gold standard it starts with harvesting the fruiting bodies at their peak from there they dry and powder the mushrooms before concentrating them in hot water for five hours before capsulation this concentrated extract undergoes the same quality testing as the rest of their herbs to ensure potency purity and integrity with gaia herbs you get mushrooms which is harder to find than you d think image by gaia herbs contributor the case for fruiting bodies here s the issue with mushroom supplements made from mycelium mushrooms are often grown using grain substrates like rice or oats this substrate allows the mycelium or the roots to grow but it s difficult to extract because of that the growth substrate often ends up in the final product which means you re taking mushrooms but also added ingredients like fillers grain and starch not only does gaia herbs harvest their supplements from the fruiting body but they also get as close to a natural environment as possible their chaga for example is grown on siberian birch located on organically managed land their reishi is cultivated on beachwood log this paints a picture of the brand s commitment to sustainable sourcing it s also how you end up with a mushroom supplement how to choose the right mushroom for your immunity but returning to why a quality mushroom supplement really matters your immune system gets more bang for your buck and by that we mean more beta glucans for years vitamin c and zinc have been ruling our immunity routines but now that we know what mushrooms are capable of that s all changing all mushrooms are packed with health benefits but certain fungi are more connected to immune support than others need a little extra respiratory support or a helping hand for your liver not to worry there s a mushroom for that reishi reishi mushroom also known as the mushroom of immortality has been shown to support overall immune function as well as cardiovascular health if you re looking to boost your overall longevity gaia herbs reishi mushroom is your go to turkey tail researchers actually consider our liver an innate immunity organ due to its high concentration of immune cells gaia herbs turkey tail promotes healthy liver function and support as the most widely studied mushroom give this fun guy a front row spot in your supplement cabinet chaga chaga is known for offering antioxidant support and has long been used to prompt healthy cell turnover and gut health another key aspect of immunity gaia herbs everyday immune is formulated with chaga reishi and maitake another mushroom known for immune support combined with immune supporting herbs this everyday supplement checks all boxes the bottom line immunity can be one of those things you take for granted until you re feeling a little under the weather we re big believers that immunity isn t just something you focus on during winter or when you feel a bug coming on immunity is a lifestyle and choosing a high quality supplement like gaia herbs is how we can ensure we re giving our immune system its best chance remember your health deserves nothing less than transparent sourcing high quality and integrity these statements have not been evaluated by the food and drug administration these products are not intended to diagnose treat cure or prevent any disease sources https www ncbi nlm nih gov pmc articles pmc https www ncbi nlm nih gov pmc articles pmc text for example c hepatocytes are responsible and a lymphoid organ https www ncbi nlm nih gov pmc articles pmc
