url,normalized_text
https://www.mindbodygreen.com/articles/when-to-take-protein-powder,when s the best time to take protein powder what research shows mindbodygreen skip to content accessibility statement integrative health expert reviewed when to consume protein powder research backed timing tips author emma loewe expert reviewer lauren torrisi gorra m s rd march by emma loewe mbg contributor emma loewe is the former sustainability and health director at mindbodygreen she is the author of return to nature the new science of how natural landscapes restore us and the co author of the spirit almanac a modern guide to ancient self care emma received her b a in environmental science policy with a specialty in environmental communications from duke university in addition to penning over mbg articles on topics from the water crisis in california to the rise of urban beekeeping her work has appeared on grist bloomberg news bustle and forbes expert review by lauren torrisi gorra m s rd registered dietitian lauren torrisi gorra ms rd is a registered dietitian chef and writer with a love of science and passion for helping people create life long healthy habits she has a bachelor s degree in communication and media studies from fordham university a grand dipl me in culinary arts from the french culinary institute and master s degree in clinical nutrition and dietetics from new york university daily protein intake timing for weight loss pre vs post exercise morning vs evening types of protein powder recipes faq march protein is an essential macronutrient that fuels a lot more than just gains composing about of our body weight protein helps build teeny tiny cells large joints and organs and everything in between it plays a role in your energy levels immune function and metabolic health too your body is always breaking down protein so it needs a consistent supply from your diet but is there a certain time of the day that s considered best for refueling let s explore the best times to consume protein powder so it works the hardest for you why you should spread out your protein intake before you think about timing your protein to a tee you ll need to make sure you re getting enough of the macronutrient in the first place most active people will want to consume around to grams of protein per kilogram of body weight if you weigh pounds that s around to grams of protein per day by hitting this threshold you re ensuring that your body has enough protein to build muscle support metabolism and insulin sensitivity and more the most important part it seems based on the research is total protein intake in a day says shawn arent ph d a professor of exercise science at the university of south carolina you can time the crap out of your protein but if you re not eating enough per day it s a drop in the bucket ideally you ll be able to meet your protein needs by eating whole food protein sources however protein powders can be a convenient way to fill gaps in the diet and get a meaningful amount of protein without needing to fire up your stove rather than trying to cram grams of protein into one meal that s a lot of eggs and whey you ll want to spread your protein intake throughout the day starting with breakfast the first meal of the day is important because when you re sleeping your body is in a catabolic state in which muscle tissue is broken down for its constituent amino acids and you ll stay in this state until you replenish your body with the amino acids it needs to enter an anabolic state and rebuild muscle again a process called muscle protein synthesis mps the first meal after you re coming out of an overnight fast is absolutely critical don layman ph d a leading protein and amino acid researcher and professor at the university of illinois at urbana champaign previously told mindbodygreen until you have a meal that triggers mps you ll stay catabolic and what sets off mps and gets us into an anabolic state you guessed it protein layman s research has found that consuming an adequate serving of protein at least to grams starting at your first meal of the day will support muscle protein synthesis more effectively than eating the majority of your protein at dinner it will also set you up to fulfill that all important daily protein quota as long as you re consuming enough protein a day and spreading it across a few meals and snacks the exact hours of your protein intake don t matter as much however there are some ways to optimize your timing slightly depending on your specific goals summary before you think about protein timing you ll want to make sure you re eating enough protein per day upward of grams for most people and splitting it up across a few meals starting at breakfast aim for roughly grams of protein per meal protein to lose weight if you re looking to lose weight while maintaining muscle mass consuming protein powder in the morning can be beneficial not only will it kick start mps but protein is also highly satiating meaning it can help you start your day feeling full and satisfied it also has what s known as an insulinotropic effect so it helps clear glucose from your blood and can assist with stabilizing blood sugar less insulin spiking means more sustained energy levels and fewer hunger pangs throughout the day gabrielle lyon d o a functional medicine physician and the founder of the institute for muscle centric medicine previously told mindbodygreen in research on adolescents with obesity eating a high protein breakfast grams helped prevent fat gain and reduce daily hunger more than eating a lower protein breakfast or skipping breakfast altogether if fat loss is your goal you ll want to get plenty of exercise particularly strength training daily too pairing a protein rich diet with intermittent fasting has also been shown to promote fat loss and improved metabolic health in recent research likely due to the way that restricting your eating window can reduce calorie intake just note that this strategy is not effective for everybody and may be unsafe for pregnant and breastfeeding women or anyone with a history of an eating disorder talk to your doctor before trying it here is a complete guide to using protein powder for weight loss summary if you re looking to lose fat while building or maintaining muscle consuming protein in the morning and pairing it with exercise can help keep you more full and satisfied throughout the day should i consume protein before or after exercise there s a reason the stereotypical weightlifter follows up every gym session with a protein shake eating protein after a workout helps refuel the body and restore muscle tissue that was damaged during exercise the anabolic window of opportunity is the amount of time post workout that your body is primed to synthesize new proteins researchers used to think this time window was relatively short around to minutes but this notion has since been challenged the reality is that the window is more like a garage door it s much bigger than we thought it was arent explains if you don t eat protein right after a workout it s not like you re going to lose all the hard work you just put in so if you forgot to bring your shake to the gym it s fine to wait until you re home and showered to refuel with protein as well as some carbs whether you eat protein one hour after a workout or three research shows the effects on mps will be similar one exception is if you work out first thing in the morning without eating beforehand in that case you ll want to refuel quickly because you may still be in a more catabolic state as for the benefits of eating protein before a workout the research is more mixed and it seems to depend on the person there are some early studies suggesting that pre workout protein might be more important for women but we don t know for sure summary eating post workout seems to be more important for recovery and mps but if you prefer to sip a protein shake before the gym and it doesn t upset your stomach there s certainly no harm in doing so should i consume protein in the morning or at night as we ve already covered eating protein in the morning or during your first meal is key for getting your day off on the right foot however emerging research is also finding that consuming a concentrated dose of protein right before bed can be helpful for heavy exercisers one study published in frontiers of nutrition found that for those who were doing a prolonged period of resistance training consuming grams of protein before bed stimulated mps during the overnight recovery period a time when muscle would usually be breaking down this can also be a smart strategy for athletes with very high protein needs who would benefit from having one more protein heavy meal each day there is also some evidence though it s inconclusive that consuming protein right before bed can help older people combat age related muscle loss which is a concern after the age of or so if you opt to consume protein shortly before bed be sure to choose a protein powder that s easy to digest and won t disrupt your sleep slow digesting casein protein is a popular choice related read the best time to take vitamins supplements a scannable guide summary if you re going to choose one or the other drinking protein powder in the morning will be more beneficial for most people however athletes and those with very high protein needs may also get added benefits from protein right before bed types of protein powder as arent puts it you can look at your protein routine like a birthday cake your total protein intake is the cake itself and it sets the foundation protein timing is like the icing and in this scenario the protein type is the candle on top to maximize your recovery and growth you ll want to opt for a protein source that contains all the essential amino acids in the correct amounts you should pay particular attention to leucine which is known as an anabolic trigger because of its ability to switch on mps but they re all important leucine starts the igniter but you still have to have sufficient amounts of the other amino acids to keep protein synthesis going says matthew e stark m s rdn ldn the program coordinator of nutrition and dietetics at northern illinois university if you re low on one that could stunt the protein synthesis even though you did have sufficient leucine animal proteins tend to be higher in leucine than plant proteins but a well formulated plant protein powder can hit the leucine threshold needed to spur mps around grams per serving there are many types of protein powders available each with its own pros and cons and you can learn all about the most popular here when shopping for the right protein powder for you be it whey isolate or pea protein be sure to look for one that has at least to grams of protein per serving has a healthy amino acid composition is sustainably sourced comes from a reputable company and is low on additives and extra sugars mbg s picks for clean protein powders mt capra clean whey protein antler farms new zealand whey protein isolate truvani organic vanilla plant based protein powder creative ways to consume protein powder we ve established that protein is essential throughout the day from morning until night if you re looking to use protein powder to up your daily protein intake here are some creative ways to do so beyond just another smoothie or shake breakfast add it to your overnight oats or hot oatmeal add flavored protein to coffee add it to the batter of your waffles or pancakes snack add it to your brownie or cookie batter whip up a collagen pudding use it to make energy balls dinner swirl unflavored protein into mashed potatoes or yogurt mix it into salad dressing faq is it better to drink a protein shake before or after workout drinking a protein shake after a workout will go a longer way in supporting recovery and muscle protein synthesis but you don t need to rush to drink it right away the anabolic window is longer than previously thought so just aim to consume protein within a few hours of exercise should i take protein powder every day you should be consuming enough protein every day but it doesn t need to be in powder form but if you struggle to meet your daily protein requirements with food alone consuming protein powder every day is a safe way to supplement should i drink protein shakes on non workout days your body always needs protein even on rest days and if a protein shake helps you fulfill your daily quota you should still drink it even on days you don t work out it s a myth that eating protein without working out makes you gain weight learn why here the takeaway as long as you re getting enough protein each day the timing of your protein doesn t matter as much however there are a few times throughout the day like in the morning and after a workout when drinking a protein shake may be even more beneficial for muscle growth and recovery sources https academic oup com ajcn article https pubmed ncbi nlm nih gov https www ncbi nlm nih gov pmc articles pmc https pubmed ncbi nlm nih gov https pubmed ncbi nlm nih gov https pubmed ncbi nlm nih gov https pubmed ncbi nlm nih gov https www ncbi nlm nih gov pmc articles pmc https pubmed ncbi nlm nih gov https www ncbi nlm nih gov pmc articles pmc https pubmed ncbi nlm nih gov https www ncbi nlm nih gov pmc articles pmc https pubmed ncbi nlm nih gov https academic oup com jn article s https www ncbi nlm nih gov pmc articles pmc
https://us.no7beauty.com/collections/future-renew.list,no future renew skincare collection no us cookie consent
https://podcasts.apple.com/us/podcast/the-secret-to-sustainable-high-performance-legendary/id1246494475?i=1000732505295,the secret to sustainable high the mindbodygreen podcast apple podcasts there are only two things that are really important in life one is purpose and the other is authentic relationships explains lew frankfort frankfort the longtime ceo of coach and author of bag man joins us today to explain how to sustain high performance without sacrificing health relationships or presence and to share the leadership and life strategies that helped him thrive under pressure does balance really exist a protocol for napping separating work from home intentional language to handle conflict how to become a better listener prioritizing collaboration frankfort s health journey stress purpose the three types of relationships longevity healthy aging frankfort s health scare succeeding across domains of life his legacy advice to his younger self referenced in the episode pick up his book bag man https www amazon com bag man story behind improbable dp b drzgq fv learn more about frankfort https lewfrankfort com we hope you enjoy this episode and feel free to watch the full video on youtube whether it s an article or podcast we want to know what we can do to help here at mindbodygreen let us know at podcast mindbodygreen com learn more about your ad choices visit megaphone fm adchoices jason wachob host show the mindbodygreen podcast channel mindbodygreen frequency updated weekly published october at am utc length min rating clean to listen to explicit episodes sign in sign in or sign up to follow shows save episodes and get the latest updates algeria angola armenia azerbaijan bahrain benin botswana brunei darussalam burkina faso cameroun cape verde chad c te d ivoire congo the democratic republic of the egypt eswatini gabon gambia ghana guinea bissau india iraq israel jordan kenya kuwait lebanon liberia libya madagascar malawi mali mauritania mauritius morocco mozambique namibia niger english nigeria oman qatar congo republic of rwanda s o tom and pr ncipe saudi arabia senegal seychelles sierra leone south africa sri lanka tajikistan tanzania united republic of tunisia turkmenistan united arab emirates uganda yemen zambia zimbabwe afghanistan australia bhutan cambodia fiji indonesia english kazakhstan kyrgyzstan lao people s democratic republic malaysia english maldives micronesia federated states of mongolia myanmar nauru nepal new zealand pakistan palau papua new guinea philippines singapore solomon islands thailand tonga turkmenistan uzbekistan vanuatu vietnam albania armenia sterreich belarus belgium bosnia and herzegovina bulgaria croatia cyprus czechia denmark estonia finland france fran ais georgia deutschland greece hungary iceland ireland italia kosovo latvia lithuania luxembourg english malta moldova republic of montenegro nederland north macedonia norway poland portugal portugu s romania serbia slovakia slovenia espa a sverige schweiz t rkiye english ukraine united kingdom anguilla antigua and barbuda argentina espa ol bahamas barbados belize bermuda bolivia espa ol brasil virgin islands british cayman islands chile espa ol colombia espa ol costa rica espa ol dominica rep blica dominicana ecuador espa ol el salvador espa ol grenada guatemala espa ol guyana honduras espa ol jamaica m xico montserrat nicaragua espa ol panam paraguay espa ol per st kitts and nevis saint lucia st vincent and the grenadines suriname trinidad and tobago turks and caicos uruguay english venezuela espa ol canada english canada fran ais united states estados unidos espa ol m xico tats unis fran ais france estados unidos portugu s brasil hoa k
https://www.mindbodygreen.com/articles/these-foods-drinks-and-nutrients-help-fight-depression-and-anxiety-inhibiting-inflammation,these foods drinks nutrients help fight depression and anxiety mindbodygreen skip to content accessibility statement functional food ward off depression anxiety with these key foods drinks nutrients author morgan chamberlain december former mbg editor by morgan chamberlain former mbg editor morgan chamberlain is mindbodygreen s former supplement editor she graduated from syracuse university with a bachelor of science degree in magazine journalism and a minor in nutrition image by pixel stories stocksy december depression and anxiety are as conventional as the common cold these days whether you ve struggled with clinical depression or anxiety for years or have experienced bouts of one or both alongside stress or chronic illness these neuropsychiatric disorders are all but unavoidable thanks to research on the gut brain axis scientists have found that our diet and overall gut health play a significant role in mental well being and an antioxidants narrative review breaks down exactly which foods drinks and nutrients have been found to prevent and manage depression and anxiety symptoms how diet can help prevent manage depression anxiety whether you ve personally dealt with these neuropsychiatric disorders or have witnessed a family member friend or peer fight their own mental health battles everyone is affected by depression and anxiety in some shape or form whole foods and nutrients like fish coffee tea berries omega fatty acids antioxidants e g lycopene resveratrol selenium and even dietary fiber have been found to play a critical role in the prevention and management of depression and anxiety these nutrients and foods help promote mental well being by inhibiting inflammation fighting free radicals to reduce oxidative stress modulating gut microbiota preventing hyperactivity of the hypothalamic pituitary adrenal hpa axis i e the neuroendocrine mechanism that controls the body s reaction to stress supporting healthy levels of monoamine neurotransmitters serotonin dopamine and norepinephrine which play a key role in mood regulation omega potency delivers the right amount of crucial fatty acids so your body can function at its best foods drinks and nutrients for depression pathologically depression is often associated with inflammation in the brain monoamine neurotransmitter deficiency gut microbiota disorder and hpa axis hyperactivity consumption of the following foods drinks and dietary nutrients have been found to lower the risk of depression and depressive symptoms in clinical trials fish fatty fish fatty fish mushroom fiber walnuts green tea tea coffee dietary fiber selenium in animal studies many common nutrients and supplement ingredients including fish oil and omega s navel orange and garlic essential oils antioxidants e g curcumin lycopene resveratrol maqui berry and egcg and various probiotic strains have also been found to protect against and treat depressive mechanisms foods drinks and nutrients for anxiety according to the narrative review anxiety is initiated and developed by oxidative stress inflammation and serotonergic and noradrenergic dysfunction i e imbalances in serotonin and noradrenaline aka norepinephrine but certain foods and nutrients can help consumption of the following foods drinks and dietary nutrients have been found to lower the risk of and protect against anxiety in clinical trials legumes and nuts dietary fiber omega fatty acids bcaas vitamin b in animal studies a variety of foods nutrients and common supplement ingredients such as honey goat milk fat breadfruit pulp red pomegranate fruit extract bergamot essential oil omega s phytonutrients e g saffron curcumin and l theanine and various probiotic strains have also been found to reduce the prevalence and treat the effects of anxiety the takeaway there are a number of neuroprotective foods drinks and nutrients you can add to your diet to help prevent and or manage depression and anxiety for an even easier solution consider adding a quality supplement with one or many of the ingredients listed above to your daily routine omega potency delivers the right amount of crucial fatty acids so your body can function at its best
