url,normalized_text
https://en.wikipedia.org/wiki/LCCN_(identifier),library of congress control number wikipedia jump to content from wikipedia the free encyclopedia redirected from lccn identifier numbering system for catalog records lccn redirects here for the denomination see lutheran church of christ in nigeria the library of congress control number lccn is a serially based system of numbering cataloged records in the library of congress in the united states it is not related to the contents of any book and should not be confused with library of congress classification lcc retrieved from https en wikipedia org w index php title library of congress control number oldid categories library of congress identifiers library cataloging and classification hidden categories articles with short description short description is different from wikidata use american english from march all wikipedia articles written in american english use mdy dates from march all articles with vague or ambiguous time vague or ambiguous time from september webarchive template wayback links library of congress control number add topic
https://en.wikipedia.org/wiki/Maternal_health,maternal health wikipedia jump to content from wikipedia the free encyclopedia health of women during pregnancy child birth and the postpartum period part of a series on women s health symbol of women s health reproductive and sexual health reproductive health reproductive tract external female genitalia clitoris clitoral hood labia minora labia majora vagina cervix uterus fallopian tube ovary reproductive system disease maternal health pregnancy unintended pregnancy gravidity and parity obstetrics obstetrics and gynaecology antenatal care adolescent pregnancy complications of pregnancy hyperemesis gravidarum ectopic pregnancy miscarriage obstetrical bleeding gestational diabetes excessive gestational weight gain hypertension preeclampsia eclampsia childbirth midwifery preterm birth multiple births oxytocin obstructed labor cesarian section retained placenta obstetrical fistulae vesicovaginal fistula rectovaginal fistula postpartum care maternal deaths perinatal mortality stillbirths abortion mother to child transmission sterilization compulsory sterilization reproductive life plan infertility childlessness assisted reproductive technology in vitro fertilization parenting adoption fostering contraception family planning safe sex intrauterine devices oral contraceptives hormonal contraception tubal ligation male contraceptive condoms contraceptive prevalence contraceptive security planned parenthood menstruation menarche menstrual cycle menstrual aids tampons sanitary pads dysmenorrhea menorrhagia amenorrhoea menopause hormone replacement therapy sexual health sexually transmitted infections hiv human papilloma virus hpv vaccine pelvic inflammatory disease female genital cutting clitoridectomy infibulation child marriage forced marriage polygamy sexual intercourse orgasm dyspareunia other sex differences sex education puberty breast health gynaecological disorders vaginitis non reproductive health violence against women domestic violence intimate partner violence misogyny sexual harassment sexual assault rape femicide gender discrimination non communicable diseases gynecologic cancer lung cancer breast cancer uterine cancer endometrial cancer cervical cancer papanicolaou test ovarian cancer cardiovascular disease dementia alzheimer s disease bone health osteoporosis hip fracture autoimmune disease anaemia other mental health anxiety depression major depressive disorder urinary tract urethra urinary tract infection urinary incontinence sociocultural factors poverty disadvantaged gender equality healthcare inequality gender disparities in health social determinants of health reproductive justice women s empowerment politics research advocacy united nations cedaw devaw day of girls csw un women united states office of research on women s health women s health initiative international center for research on women nurses health study black women s health study cartwright inquiry society for women s health research women s health by country china ethiopia india family planning russia reproductive health us reproductive health birth control v t e maternal health is the health of women during pregnancy childbirth and the postpartum period in most cases maternal health encompasses the health care dimensions of family planning preconception prenatal and postnatal care in order to ensure a positive and fulfilling experience in other cases maternal health can reduce maternal morbidity and mortality maternal health revolves around the health and wellness of pregnant individuals particularly when they are pregnant at the time they give birth and during child raising who has indicated that even though motherhood has been considered as a fulfilling natural experience that is emotional to the mother a high percentage of women develop health problems sometimes resulting in death because of this there is a need to invest in the health of women the investment can be achieved in different ways among the main ones being subsidizing the healthcare cost education on maternal health encouraging effective family planning and checking up on the health of individuals who have given birth maternal morbidity and mortality particularly affects women of color and women living in low and lower middle income countries retrieved from https en wikipedia org w index php title maternal health oldid categories maternal health sexual health obstetrics women s health midwifery hidden categories cs long volume value articles with short description short description matches wikidata use dmy dates from july all articles with unsourced statements articles with unsourced statements from april articles with unsourced statements from april wikipedia articles in need of updating from july all wikipedia articles in need of updating all articles with specifically marked weasel worded phrases articles with specifically marked weasel worded phrases from july maternal health add topic
https://en.wikipedia.org/wiki/Orienteering,orienteering wikipedia jump to content from wikipedia the free encyclopedia sport using maps and compasses not to be confused with orientation or amateur radio direction finding orienteering an orienteer punching a control point highest governing body international orienteering federation iof first public contest union between sweden and norway clubs national federations characteristics contact no team members individuals or teams of varying size mixed sex mixed participation with most competitions held in separate divisions type outdoor equipment compass orienteering map control punch presence country or region worldwide olympic no world championships world games official iof orienteering pictogram orienteering is a group of sports in which participants use a map and compass to navigate from point to point in unfamiliar terrain as quickly as possible the sport originated from military land navigation training in the late th century it has since evolved into several competitive forms where participants race against the clock while navigating through checkpoints variants include automobile underwater mountain bike ski and trail orienteering the most common form is foot orienteering also known as footo in formal foot orienteering competitions participants are given a specially prepared orienteering map usually topographical which they use to locate control points orienteering is part of the world games and the world police and fire games retrieved from https en wikipedia org w index php title orienteering oldid categories orienteering individual sports navigation outdoor locating games racing hidden categories cs unfit url cs swedish language sources sv articles with short description short description is different from wikidata articles containing potentially dated statements from all articles containing potentially dated statements commons category link is on wikidata orienteering add topic
https://en.wikipedia.org/wiki/Pessimism,pessimism wikipedia jump to content from wikipedia the free encyclopedia negative mental attitude this article needs additional citations for verification please help improve this article by adding citations to reliable sources unsourced material may be challenged and removed find sources pessimism news newspapers books scholar jstor september learn how and when to remove this message an optimist and a pessimist vladimir makovsky pessimism is a mental attitude in which an undesirable outcome is anticipated from a given situation pessimists tend to focus on the negatives of life in general a common question asked to test for pessimism is is the glass half empty or half full in this situation a pessimist is said to see the glass as half empty or in extreme cases completely empty while an optimist is said to see the glass as half full throughout history the pessimistic disposition has had effects on all major areas of thinking retrieved from https en wikipedia org w index php title pessimism oldid categories pessimism psychological attitude emotions motivation depression mood philosophy of life hidden categories cs finnish language sources fi articles with short description short description is different from wikidata articles needing additional references from september all articles needing additional references all articles with unsourced statements articles with unsourced statements from september articles containing german language text articles with unsourced statements from december articles with unsourced statements from december wikipedia articles incorporating a citation from the encyclopaedia britannica with wikisource reference articles containing welsh language text articles containing danish language text articles containing japanese language text articles containing portuguese language text pessimism add topic
https://en.wikipedia.org/wiki/Holocene,holocene wikipedia jump to content from wikipedia the free encyclopedia current geological epoch for other uses see holocene disambiguation recent era redirects here for the human sense see human history modern era holocene ma pre o s d c p t j k pg n map of earth as it appears during the current holocene epoch meghalayan age chronology cenozoic quaternary pleistocene holocene greenlandian northgrippian meghalayan y k year kiloyear event kiloyear event subdivision of the holocene according to the ics as of vertical axis scale gregorian years etymology name formality formal usage information celestial body earth regional usage global ics time scale s used ics time scale definition chronological unit epoch stratigraphic unit series time span formality formal lower boundary definition end of the younger dryas stadial lower boundary gssp ngrip ice core greenland n w n w lower gssp ratified upper boundary definition present day upper boundary gssp n a n a upper gssp ratified n a the holocene h l s i n o h o l l o is the current geological epoch beginning approximately years ago it follows the last glacial period which concluded with the holocene glacial retreat the holocene and the preceding pleistocene together form the quaternary period the holocene is an interglacial period within the ongoing glacial cycles of the quaternary and is equivalent to marine isotope stage the name holocene comes from ancient greek h los meaning whole and kain s meaning new recent referring that this epoch is entirely new the holocene correlates with the last maximum axial tilt towards the sun of the earth s obliquity the holocene corresponds with the rapid proliferation growth and impacts of the human species worldwide hence the holocene is often commonly referred to as the age of humans including all of its written history technological revolutions development of major civilizations and overall significant transition towards urban living in the present the human impact on modern era earth and its ecosystems may be considered of global significance for the future evolution of living species including approximately synchronous lithospheric evidence or more recently hydrospheric and atmospheric evidence of the human impact following the extinction of most large terrestrial mammals outside of africa during the preceding late pleistocene the ecosystems of the holocene continued to be impacted by extinctions the ongoing holocene extinction largely of human causation in july the international union of geological sciences split the holocene epoch into three distinct ages based on the climate greenlandian years ago to years ago northgrippian years ago to years ago and meghalayan years ago to the present as proposed by the international commission on stratigraphy the oldest age the greenlandian was characterized by a warming following the preceding ice age the northgrippian age is known for vast cooling due to a disruption in ocean circulations that was caused by the melting of glaciers the most recent age of the holocene is the present meghalayan which began with extreme drought that lasted around years retrieved from https en wikipedia org w index php title holocene oldid categories holocene geological epochs quaternary geochronology interglacials historical eras hidden categories cs french language sources fr webarchive template wayback links cs long volume value cs errors missing periodical cs maint article number as page number wikipedia articles incorporating a citation from the encyclopaedia britannica with wikisource reference cs spanish language sources es articles with short description short description is different from wikidata pages using gadget wikiminiatlas articles containing potentially dated statements from april all articles containing potentially dated statements all articles with unsourced statements articles with unsourced statements from may pages using sidebar with the child parameter commons category link is on wikidata holocene add topic
https://en.wikipedia.org/wiki/Etiology,etiology wikipedia jump to content from wikipedia the free encyclopedia study of causation or origination not to be confused with etymology or ethology this article needs additional citations for verification please help improve this article by adding citations to reliable sources unsourced material may be challenged and removed find sources etiology news newspapers books scholar jstor october learn how and when to remove this message etiology i t i l d i alternatively spelled aetiology or tiology is the study of causation or origination the word is derived from the greek word aitiolog a meaning giving a reason for from ait a cause and log a study of more completely etiology is the study of the causes origins or reasons behind the way that things are or the way they function or it can refer to the causes themselves the word is commonly used in medicine pertaining to causes of disease or illness and in philosophy but also in physics biology psychology political science geography cosmology spatial analysis and theology in reference to the causes or origins of various phenomena in the past when many physical phenomena were not well understood or when histories were not recorded myths often arose to provide etiologies thus an etiological myth or origin myth is a myth that has arisen been told over time or written to explain the origins of various social or natural phenomena for example virgil s aeneid is a national myth written to explain and glorify the origins of the roman empire in theology many religions have creation myths explaining the origins of the world or its relationship to believers retrieved from https en wikipedia org w index php title etiology oldid categories causes of conditions cause medicine origin myths mythography mythology origins hidden categories articles with short description short description matches wikidata articles needing additional references from october all articles needing additional references articles containing ancient greek to language text etiology add topic
https://en.wikipedia.org/wiki/Baluster,baluster wikipedia jump to content from wikipedia the free encyclopedia architectural element vertical moulded shaft illustration of various examples of balusters in a handbook of ornament by franz s meyer the term derives from the swelling form of the half open flower of punica granatum in italian balaustra a baluster b l s t r is an upright support often a vertical moulded shaft square or lathe turned form found in stairways parapets and other architectural features in furniture construction it is known as a spindle common materials used in its construction are wood stone and less frequently metal and ceramic a group of balusters supporting a guard railing coping or ornamental detail is known as a balustrade the term baluster shaft is used to describe forms such as a candlestick upright furniture support and the stem of a brass chandelier citation needed the term banister also bannister refers to a baluster or to the system of balusters and handrail of a stairway it may be used to include its supporting structures such as a supporting newel post in the uk there are different height requirements for domestic and commercial balustrades as outlined in approved document k retrieved from https en wikipedia org w index php title baluster oldid categories architectural elements garden features stairways pedestrian infrastructure architectural history ironmongery hidden categories pages using the phonos extension wikipedia articles incorporating a citation from the encyclopaedia britannica with wikisource reference wikipedia articles incorporating text from the encyclop dia britannica cs brazilian portuguese language sources pt br articles with short description short description matches wikidata pages including recorded pronunciations all articles with unsourced statements articles with unsourced statements from september articles containing french language text articles containing italian language text articles with unsourced statements from march commons category link is on wikidata baluster add topic
